{
  "$schema": "https://json-schema.org/draft/2020-12/schema",
  "$id": "https://schemas.ultikits.com/protocol/v2/2.0.0/agent/config.entries.result.schema.json",
  "type": "object",
  "properties": {
    "v": {
      "type": "number",
      "const": 2
    },
    "id": {
      "type": "string",
      "pattern": "^[0-9A-HJKMNP-TV-Z]{26}$"
    },
    "type": {
      "type": "string",
      "const": "config.entries.result"
    },
    "ts": {
      "type": "integer",
      "minimum": 0,
      "maximum": 8640000000000000
    },
    "replyTo": {
      "type": "string",
      "pattern": "^[0-9A-HJKMNP-TV-Z]{26}$"
    },
    "payload": {
      "oneOf": [
        {
          "type": "object",
          "properties": {
            "status": {
              "type": "string",
              "const": "ok"
            },
            "data": {
              "type": "object",
              "properties": {
                "path": {
                  "type": "string",
                  "minLength": 1,
                  "maxLength": 512,
                  "pattern": "^(?:[^./\\\\:\\u0000-\\u001F][^/\\\\:\\u0000-\\u001F]*|\\.[^./\\\\:\\u0000-\\u001F][^/\\\\:\\u0000-\\u001F]*|\\.\\.[^/\\\\:\\u0000-\\u001F]+)(?:\\/(?:[^./\\\\:\\u0000-\\u001F][^/\\\\:\\u0000-\\u001F]*|\\.[^./\\\\:\\u0000-\\u001F][^/\\\\:\\u0000-\\u001F]*|\\.\\.[^/\\\\:\\u0000-\\u001F]+))*$"
                },
                "entries": {
                  "maxItems": 2000,
                  "type": "array",
                  "items": {
                    "oneOf": [
                      {
                        "type": "object",
                        "properties": {
                          "key": {
                            "type": "string",
                            "minLength": 1,
                            "maxLength": 256,
                            "pattern": "^[^.\\u0000-\\u001F]+(\\.[^.\\u0000-\\u001F]+)*$"
                          },
                          "label": {
                            "type": "string",
                            "minLength": 1,
                            "maxLength": 256
                          },
                          "comment": {
                            "anyOf": [
                              {
                                "type": "string",
                                "minLength": 1,
                                "maxLength": 2000
                              },
                              {
                                "type": "null"
                              }
                            ]
                          },
                          "type": {
                            "type": "string",
                            "const": "string"
                          },
                          "value": {
                            "anyOf": [
                              {
                                "type": "string",
                                "maxLength": 8192
                              },
                              {
                                "type": "null"
                              }
                            ]
                          },
                          "constraints": {
                            "type": "object",
                            "properties": {},
                            "additionalProperties": false
                          }
                        },
                        "required": [
                          "key",
                          "label",
                          "comment",
                          "type",
                          "value"
                        ],
                        "additionalProperties": false
                      },
                      {
                        "type": "object",
                        "properties": {
                          "key": {
                            "type": "string",
                            "minLength": 1,
                            "maxLength": 256,
                            "pattern": "^[^.\\u0000-\\u001F]+(\\.[^.\\u0000-\\u001F]+)*$"
                          },
                          "label": {
                            "type": "string",
                            "minLength": 1,
                            "maxLength": 256
                          },
                          "comment": {
                            "anyOf": [
                              {
                                "type": "string",
                                "minLength": 1,
                                "maxLength": 2000
                              },
                              {
                                "type": "null"
                              }
                            ]
                          },
                          "type": {
                            "type": "string",
                            "const": "integer"
                          },
                          "value": {
                            "anyOf": [
                              {
                                "type": "integer",
                                "minimum": -9007199254740991,
                                "maximum": 9007199254740991
                              },
                              {
                                "type": "null"
                              }
                            ]
                          },
                          "constraints": {
                            "type": "object",
                            "properties": {
                              "min": {
                                "type": "integer",
                                "minimum": -9007199254740991,
                                "maximum": 9007199254740991
                              },
                              "max": {
                                "type": "integer",
                                "minimum": -9007199254740991,
                                "maximum": 9007199254740991
                              }
                            },
                            "additionalProperties": false
                          }
                        },
                        "required": [
                          "key",
                          "label",
                          "comment",
                          "type",
                          "value"
                        ],
                        "additionalProperties": false
                      },
                      {
                        "type": "object",
                        "properties": {
                          "key": {
                            "type": "string",
                            "minLength": 1,
                            "maxLength": 256,
                            "pattern": "^[^.\\u0000-\\u001F]+(\\.[^.\\u0000-\\u001F]+)*$"
                          },
                          "label": {
                            "type": "string",
                            "minLength": 1,
                            "maxLength": 256
                          },
                          "comment": {
                            "anyOf": [
                              {
                                "type": "string",
                                "minLength": 1,
                                "maxLength": 2000
                              },
                              {
                                "type": "null"
                              }
                            ]
                          },
                          "type": {
                            "type": "string",
                            "const": "number"
                          },
                          "value": {
                            "type": [
                              "number",
                              "null"
                            ]
                          },
                          "constraints": {
                            "type": "object",
                            "properties": {
                              "min": {
                                "type": "number"
                              },
                              "max": {
                                "type": "number"
                              }
                            },
                            "additionalProperties": false
                          }
                        },
                        "required": [
                          "key",
                          "label",
                          "comment",
                          "type",
                          "value"
                        ],
                        "additionalProperties": false
                      },
                      {
                        "type": "object",
                        "properties": {
                          "key": {
                            "type": "string",
                            "minLength": 1,
                            "maxLength": 256,
                            "pattern": "^[^.\\u0000-\\u001F]+(\\.[^.\\u0000-\\u001F]+)*$"
                          },
                          "label": {
                            "type": "string",
                            "minLength": 1,
                            "maxLength": 256
                          },
                          "comment": {
                            "anyOf": [
                              {
                                "type": "string",
                                "minLength": 1,
                                "maxLength": 2000
                              },
                              {
                                "type": "null"
                              }
                            ]
                          },
                          "type": {
                            "type": "string",
                            "const": "boolean"
                          },
                          "value": {
                            "type": [
                              "boolean",
                              "null"
                            ]
                          }
                        },
                        "required": [
                          "key",
                          "label",
                          "comment",
                          "type",
                          "value"
                        ],
                        "additionalProperties": false
                      },
                      {
                        "type": "object",
                        "properties": {
                          "key": {
                            "type": "string",
                            "minLength": 1,
                            "maxLength": 256,
                            "pattern": "^[^.\\u0000-\\u001F]+(\\.[^.\\u0000-\\u001F]+)*$"
                          },
                          "label": {
                            "type": "string",
                            "minLength": 1,
                            "maxLength": 256
                          },
                          "comment": {
                            "anyOf": [
                              {
                                "type": "string",
                                "minLength": 1,
                                "maxLength": 2000
                              },
                              {
                                "type": "null"
                              }
                            ]
                          },
                          "type": {
                            "type": "string",
                            "const": "string_list"
                          },
                          "value": {
                            "anyOf": [
                              {
                                "maxItems": 500,
                                "type": "array",
                                "items": {
                                  "type": "string",
                                  "maxLength": 1024
                                }
                              },
                              {
                                "type": "null"
                              }
                            ]
                          }
                        },
                        "required": [
                          "key",
                          "label",
                          "comment",
                          "type",
                          "value"
                        ],
                        "additionalProperties": false
                      },
                      {
                        "type": "object",
                        "properties": {
                          "key": {
                            "type": "string",
                            "minLength": 1,
                            "maxLength": 256,
                            "pattern": "^[^.\\u0000-\\u001F]+(\\.[^.\\u0000-\\u001F]+)*$"
                          },
                          "label": {
                            "type": "string",
                            "minLength": 1,
                            "maxLength": 256
                          },
                          "comment": {
                            "anyOf": [
                              {
                                "type": "string",
                                "minLength": 1,
                                "maxLength": 2000
                              },
                              {
                                "type": "null"
                              }
                            ]
                          },
                          "type": {
                            "type": "string",
                            "const": "enum"
                          },
                          "value": {
                            "anyOf": [
                              {
                                "type": "string",
                                "maxLength": 256
                              },
                              {
                                "type": "null"
                              }
                            ]
                          },
                          "constraints": {
                            "type": "object",
                            "properties": {
                              "options": {
                                "minItems": 1,
                                "maxItems": 200,
                                "type": "array",
                                "items": {
                                  "type": "string",
                                  "minLength": 1,
                                  "maxLength": 256
                                }
                              }
                            },
                            "required": [
                              "options"
                            ],
                            "additionalProperties": false
                          }
                        },
                        "required": [
                          "key",
                          "label",
                          "comment",
                          "type",
                          "value",
                          "constraints"
                        ],
                        "additionalProperties": false
                      }
                    ]
                  }
                },
                "version": {
                  "type": "string",
                  "pattern": "^[0-9a-f]{64}$"
                }
              },
              "required": [
                "path",
                "entries",
                "version"
              ],
              "additionalProperties": false
            },
            "message": {
              "type": "string",
              "minLength": 1,
              "maxLength": 500
            }
          },
          "required": [
            "status",
            "data"
          ],
          "additionalProperties": false
        },
        {
          "type": "object",
          "properties": {
            "status": {
              "type": "string",
              "const": "error"
            },
            "code": {
              "type": "string",
              "enum": [
                "path_not_allowed",
                "not_found",
                "config_invalid",
                "internal_error"
              ]
            },
            "message": {
              "type": "string",
              "minLength": 1,
              "maxLength": 500
            },
            "details": {
              "type": "object",
              "propertyNames": {
                "type": "string",
                "minLength": 1,
                "maxLength": 64
              },
              "additionalProperties": {
                "anyOf": [
                  {
                    "type": "string",
                    "maxLength": 500
                  },
                  {
                    "type": "number"
                  },
                  {
                    "type": "boolean"
                  },
                  {
                    "type": "null"
                  },
                  {
                    "maxItems": 50,
                    "type": "array",
                    "items": {
                      "type": "string",
                      "maxLength": 200
                    }
                  }
                ]
              }
            }
          },
          "required": [
            "status",
            "code",
            "message"
          ],
          "additionalProperties": false
        }
      ]
    }
  },
  "required": [
    "v",
    "id",
    "type",
    "ts",
    "replyTo",
    "payload"
  ],
  "additionalProperties": false
}
